{
  "capabilityId": "fanuc-3x-vmc",
  "capabilityVersion": "1.0.0",
  "id": "fanuc-3x-vmc",
  "kinematicsSummary": {
    "axisIds": [
      "x",
      "y",
      "z"
    ],
    "axisTypes": [
      "prismatic",
      "prismatic",
      "prismatic"
    ],
    "bodyCount": 4,
    "jointCount": 3
  },
  "machineCapabilityId": "fanuc-3x-vmc",
  "machineDefinitionRef": {
    "machineId": "fanuc-3x-vmc",
    "schemaVersion": "1.0"
  },
  "schemaVersion": "1.0",
  "units": "mm",
  "version": "1.0.0"
}
